{
  "schema_version": "large_benchmark_v1",
  "benchmark": "id_overlap_spotcheck",
  "tier": "l1",
  "workload_dir": "benchmarks/workloads/synthetic-128/l1-100k",
  "mode": "mock",
  "spot_check": {
    "count": 10,
    "top_k": 10,
    "include_attributes": true,
    "consistency": "strong",
    "source": "vector_queries",
    "notes": "Compare id overlap@k between openpuffer and turbopuffer on the same query vectors and cosine_distance ANN. Different ANN graphs/probes may reduce overlap below k; record intersection@k for the report, not exact rank parity."
  },
  "openpuffer_namespace": "bench-large-l1-mock",
  "turbopuffer_namespace": "bench-tpuf-2026-06-04-l1-mock",
  "queries": [
    {
      "name": "vector-q00",
      "doc_index": 0,
      "top_k": 10,
      "openpuffer_count": 10,
      "turbopuffer_count": 10,
      "intersection_count": 8,
      "union_count": 12,
      "overlap_at_k": 0.8,
      "jaccard": 0.6667,
      "intersection_ids": [
        "doc-0",
        "doc-1",
        "doc-2",
        "doc-3",
        "doc-4",
        "doc-5",
        "doc-6",
        "doc-7"
      ],
      "openpuffer_ids": [
        "doc-0",
        "doc-1",
        "doc-2",
        "doc-3",
        "doc-4",
        "doc-5",
        "doc-6",
        "doc-7",
        "doc-8",
        "doc-9"
      ],
      "turbopuffer_ids": [
        "doc-0",
        "doc-1",
        "doc-2",
        "doc-3",
        "doc-4",
        "doc-5",
        "doc-6",
        "doc-7",
        "tpuf-10",
        "tpuf-11"
      ]
    },
    {
      "name": "vector-q01",
      "doc_index": 2000,
      "top_k": 10,
      "openpuffer_count": 10,
      "turbopuffer_count": 10,
      "intersection_count": 7,
      "union_count": 13,
      "overlap_at_k": 0.7,
      "jaccard": 0.5385,
      "intersection_ids": [
        "doc-2000",
        "doc-2001",
        "doc-2002",
        "doc-2003",
        "doc-2004",
        "doc-2005",
        "doc-2006"
      ],
      "openpuffer_ids": [
        "doc-2000",
        "doc-2001",
        "doc-2002",
        "doc-2003",
        "doc-2004",
        "doc-2005",
        "doc-2006",
        "doc-2007",
        "doc-2008",
        "doc-2009"
      ],
      "turbopuffer_ids": [
        "doc-2000",
        "doc-2001",
        "doc-2002",
        "doc-2003",
        "doc-2004",
        "doc-2005",
        "doc-2006",
        "tpuf-2010",
        "tpuf-2011",
        "tpuf-2012"
      ]
    },
    {
      "name": "vector-q02",
      "doc_index": 4000,
      "top_k": 10,
      "openpuffer_count": 10,
      "turbopuffer_count": 10,
      "intersection_count": 6,
      "union_count": 14,
      "overlap_at_k": 0.6,
      "jaccard": 0.4286,
      "intersection_ids": [
        "doc-4000",
        "doc-4001",
        "doc-4002",
        "doc-4003",
        "doc-4004",
        "doc-4005"
      ],
      "openpuffer_ids": [
        "doc-4000",
        "doc-4001",
        "doc-4002",
        "doc-4003",
        "doc-4004",
        "doc-4005",
        "doc-4006",
        "doc-4007",
        "doc-4008",
        "doc-4009"
      ],
      "turbopuffer_ids": [
        "doc-4000",
        "doc-4001",
        "doc-4002",
        "doc-4003",
        "doc-4004",
        "doc-4005",
        "tpuf-4010",
        "tpuf-4011",
        "tpuf-4012",
        "tpuf-4013"
      ]
    },
    {
      "name": "vector-q03",
      "doc_index": 6000,
      "top_k": 10,
      "openpuffer_count": 10,
      "turbopuffer_count": 10,
      "intersection_count": 7,
      "union_count": 13,
      "overlap_at_k": 0.7,
      "jaccard": 0.5385,
      "intersection_ids": [
        "doc-6000",
        "doc-6001",
        "doc-6002",
        "doc-6003",
        "doc-6004",
        "doc-6005",
        "doc-6006"
      ],
      "openpuffer_ids": [
        "doc-6000",
        "doc-6001",
        "doc-6002",
        "doc-6003",
        "doc-6004",
        "doc-6005",
        "doc-6006",
        "doc-6007",
        "doc-6008",
        "doc-6009"
      ],
      "turbopuffer_ids": [
        "doc-6000",
        "doc-6001",
        "doc-6002",
        "doc-6003",
        "doc-6004",
        "doc-6005",
        "doc-6006",
        "tpuf-6010",
        "tpuf-6011",
        "tpuf-6012"
      ]
    },
    {
      "name": "vector-q04",
      "doc_index": 8000,
      "top_k": 10,
      "openpuffer_count": 10,
      "turbopuffer_count": 10,
      "intersection_count": 5,
      "union_count": 15,
      "overlap_at_k": 0.5,
      "jaccard": 0.3333,
      "intersection_ids": [
        "doc-8000",
        "doc-8001",
        "doc-8002",
        "doc-8003",
        "doc-8004"
      ],
      "openpuffer_ids": [
        "doc-8000",
        "doc-8001",
        "doc-8002",
        "doc-8003",
        "doc-8004",
        "doc-8005",
        "doc-8006",
        "doc-8007",
        "doc-8008",
        "doc-8009"
      ],
      "turbopuffer_ids": [
        "doc-8000",
        "doc-8001",
        "doc-8002",
        "doc-8003",
        "doc-8004",
        "tpuf-8010",
        "tpuf-8011",
        "tpuf-8012",
        "tpuf-8013",
        "tpuf-8014"
      ]
    },
    {
      "name": "vector-q05",
      "doc_index": 10000,
      "top_k": 10,
      "openpuffer_count": 10,
      "turbopuffer_count": 10,
      "intersection_count": 8,
      "union_count": 12,
      "overlap_at_k": 0.8,
      "jaccard": 0.6667,
      "intersection_ids": [
        "doc-10000",
        "doc-10001",
        "doc-10002",
        "doc-10003",
        "doc-10004",
        "doc-10005",
        "doc-10006",
        "doc-10007"
      ],
      "openpuffer_ids": [
        "doc-10000",
        "doc-10001",
        "doc-10002",
        "doc-10003",
        "doc-10004",
        "doc-10005",
        "doc-10006",
        "doc-10007",
        "doc-10008",
        "doc-10009"
      ],
      "turbopuffer_ids": [
        "doc-10000",
        "doc-10001",
        "doc-10002",
        "doc-10003",
        "doc-10004",
        "doc-10005",
        "doc-10006",
        "doc-10007",
        "tpuf-10010",
        "tpuf-10011"
      ]
    },
    {
      "name": "vector-q06",
      "doc_index": 12000,
      "top_k": 10,
      "openpuffer_count": 10,
      "turbopuffer_count": 10,
      "intersection_count": 6,
      "union_count": 14,
      "overlap_at_k": 0.6,
      "jaccard": 0.4286,
      "intersection_ids": [
        "doc-12000",
        "doc-12001",
        "doc-12002",
        "doc-12003",
        "doc-12004",
        "doc-12005"
      ],
      "openpuffer_ids": [
        "doc-12000",
        "doc-12001",
        "doc-12002",
        "doc-12003",
        "doc-12004",
        "doc-12005",
        "doc-12006",
        "doc-12007",
        "doc-12008",
        "doc-12009"
      ],
      "turbopuffer_ids": [
        "doc-12000",
        "doc-12001",
        "doc-12002",
        "doc-12003",
        "doc-12004",
        "doc-12005",
        "tpuf-12010",
        "tpuf-12011",
        "tpuf-12012",
        "tpuf-12013"
      ]
    },
    {
      "name": "vector-q07",
      "doc_index": 14000,
      "top_k": 10,
      "openpuffer_count": 10,
      "turbopuffer_count": 10,
      "intersection_count": 7,
      "union_count": 13,
      "overlap_at_k": 0.7,
      "jaccard": 0.5385,
      "intersection_ids": [
        "doc-14000",
        "doc-14001",
        "doc-14002",
        "doc-14003",
        "doc-14004",
        "doc-14005",
        "doc-14006"
      ],
      "openpuffer_ids": [
        "doc-14000",
        "doc-14001",
        "doc-14002",
        "doc-14003",
        "doc-14004",
        "doc-14005",
        "doc-14006",
        "doc-14007",
        "doc-14008",
        "doc-14009"
      ],
      "turbopuffer_ids": [
        "doc-14000",
        "doc-14001",
        "doc-14002",
        "doc-14003",
        "doc-14004",
        "doc-14005",
        "doc-14006",
        "tpuf-14010",
        "tpuf-14011",
        "tpuf-14012"
      ]
    },
    {
      "name": "vector-q08",
      "doc_index": 16000,
      "top_k": 10,
      "openpuffer_count": 10,
      "turbopuffer_count": 10,
      "intersection_count": 9,
      "union_count": 11,
      "overlap_at_k": 0.9,
      "jaccard": 0.8182,
      "intersection_ids": [
        "doc-16000",
        "doc-16001",
        "doc-16002",
        "doc-16003",
        "doc-16004",
        "doc-16005",
        "doc-16006",
        "doc-16007",
        "doc-16008"
      ],
      "openpuffer_ids": [
        "doc-16000",
        "doc-16001",
        "doc-16002",
        "doc-16003",
        "doc-16004",
        "doc-16005",
        "doc-16006",
        "doc-16007",
        "doc-16008",
        "doc-16009"
      ],
      "turbopuffer_ids": [
        "doc-16000",
        "doc-16001",
        "doc-16002",
        "doc-16003",
        "doc-16004",
        "doc-16005",
        "doc-16006",
        "doc-16007",
        "doc-16008",
        "tpuf-16010"
      ]
    },
    {
      "name": "vector-q09",
      "doc_index": 18000,
      "top_k": 10,
      "openpuffer_count": 10,
      "turbopuffer_count": 10,
      "intersection_count": 6,
      "union_count": 14,
      "overlap_at_k": 0.6,
      "jaccard": 0.4286,
      "intersection_ids": [
        "doc-18000",
        "doc-18001",
        "doc-18002",
        "doc-18003",
        "doc-18004",
        "doc-18005"
      ],
      "openpuffer_ids": [
        "doc-18000",
        "doc-18001",
        "doc-18002",
        "doc-18003",
        "doc-18004",
        "doc-18005",
        "doc-18006",
        "doc-18007",
        "doc-18008",
        "doc-18009"
      ],
      "turbopuffer_ids": [
        "doc-18000",
        "doc-18001",
        "doc-18002",
        "doc-18003",
        "doc-18004",
        "doc-18005",
        "tpuf-18010",
        "tpuf-18011",
        "tpuf-18012",
        "tpuf-18013"
      ]
    }
  ],
  "summary": {
    "query_count": 10,
    "mean_overlap_at_k": 0.69,
    "min_overlap_at_k": 0.5,
    "max_overlap_at_k": 0.9
  },
  "notes": "Offline mock for render-report and pytest; not measured against live engines.",